<?xml version="1.0" encoding="UTF-8"?>
<!DOCTYPE PieceInfo SYSTEM "PieceData.dtd">
<PieceInfo>
    <Piece id="Infantry-Army">
        <name>步兵连-正规军</name>
        <Datas>
            <ATK>4</ATK>
            <DEF>4</DEF>
            <MOV>5</MOV>
            <cATK>2</cATK>
            <cDEF>2</cDEF>
            <cMOV>3</cMOV>
        </Datas>
        <ability canSupport="False" canAirBattle="False" />
    </Piece>

    <Piece id="Infantry-GovGuard">
        <name>步兵连-政府近卫军</name>
        <Datas>
            <ATK>3</ATK>
            <DEF>3</DEF>
            <MOV>5</MOV>
            <cATK>1</cATK>
            <cDEF>1</cDEF>
            <cMOV>3</cMOV>
        </Datas>
        <ability canSupport="False" canAirBattle="False" />
    </Piece>

    <Piece id="MachineInfantry">
        <name>机械化步兵连</name>
        <Datas>
            <ATK>6</ATK>
            <DEF>4</DEF>
            <MOV>10</MOV>
            <cATK>3</cATK>
            <cDEF>2</cDEF>
            <cMOV>4</cMOV>
        </Datas>
        <ability canSupport="False" canAirBattle="False" />
    </Piece>

    <Piece id="Mortar">
        <name>迫击炮排</name>
        <Datas>
            <ATK>-1</ATK>
            <DEF>2</DEF>
            <MOV>5</MOV>
            <cATK>-1</cATK>
            <cDEF>1</cDEF>
            <cMOV>3</cMOV>
            <activeArea>5</activeArea>
        </Datas>
        <ability canSupport="True" canAirBattle="False" />
    </Piece>

    <Piece id="SP-Mortar">
        <name>自行迫击炮连</name>
        <Datas>
            <ATK>-1</ATK>
            <DEF>3</DEF>
            <MOV>10</MOV>
            <cATK>-1</cATK>
            <cDEF>2</cDEF>
            <cMOV>4</cMOV>
            <activeArea>7</activeArea>
        </Datas>
        <ability canSupport="True" canAirBattle="False" />
    </Piece>

    <Piece id="Artillery">
        <name>炮兵连</name>
        <Datas>
            <ATK>3</ATK>
            <DEF>5</DEF>
            <MOV>5</MOV>
            <cATK>1</cATK>
            <cDEF>3</cDEF>
            <cMOV>3</cMOV>
            <activeArea>10</activeArea>
        </Datas>
        <ability canSupport="True" canAirBattle="True" />
    </Piece>

    <Piece id="Engineer">
        <name>工兵连</name>
        <Datas>
            <ATK>-1</ATK>
            <DEF>3</DEF>
            <MOV>5</MOV>
            <cATK>-1</cATK>
            <cDEF>1</cDEF>
            <cMOV>2</cMOV>
        </Datas>
        <ability canSupport="False" canAirBattle="False" canBild="True"/>
    </Piece>

    <Piece id="Anti-Aircraft">
        <name>防空连</name>
        <Datas>
            <ATK>5</ATK>
            <DEF>5</DEF>
            <MOV>3</MOV>
            <cATK>5</cATK>
            <cDEF>3</cDEF>
            <cMOV>2</cMOV>
            <activeArea>4</activeArea>
        </Datas>
        <ability canSupport="False" canAirBattle="True" />
    </Piece>
</PieceInfo>
